{
  "$schema": "https://json-schema.org/draft/2020-12/schema",
  "type": "object",
  "properties": {
    "title": {
      "type": "string"
    },
    "description": {
      "type": "string"
    },
    "url": {
      "type": "string"
    },
    "repoUrl": {
      "type": "string",
      "format": "uri"
    },
    "gif": {
      "type": "string"
    },
    "featured": {
      "default": false,
      "type": "boolean"
    },
    "order": {
      "default": 99,
      "type": "number"
    },
    "$schema": {
      "type": "string"
    }
  },
  "required": [
    "title",
    "description",
    "url",
    "featured",
    "order"
  ],
  "additionalProperties": false
}